<?xml version="1.0" encoding="UTF-8"?>
<!--
 This file defines the default (factory) configuration for the Rainbow
 component. This configuration is used by the component's resetConfiguration()
 method.
 $Revision: 1.6 $
 $State: Exp $
 $Date: 2006/10/04 21:30:38 $
 $Source: /home/bob/CVSRepository/projects/core/core.ear/configure-server-ejb.jar/com/ail/core/configure/server/ServerDefaultConfig.xml,v $
-->
<configuration xsi:noNamespaceSchemaLocation="http://www.appliedindustriallogic.com/schemas/Configuration.xsd"
               xmlns:xsi="http://www.w3.org/2001/XMLSchema-instance">
    <name>Configure ServerBean configuration</name>
    <timeout>60000</timeout>
    <who>factory</who>
    <version>$Revision: 1.6 $</version>

    <types>

        <!--====================================-->
        <!--   Define the component's services  -->
        <!--====================================-->
        <service name="GetNamespacesService" builder="ClassBuilder" key="com.ail.core.command.ClassAccessor">
            <parameter name="ServiceClass">com.ail.core.configure.server.GetNamespacesService</parameter>
        </service>
        <service name="GetConfigurationService" builder="ClassBuilder" key="com.ail.core.command.ClassAccessor">
            <parameter name="ServiceClass">com.ail.core.configure.server.GetConfigurationService</parameter>
        </service>
        <service name="SetConfigurationService" builder="ClassBuilder" key="com.ail.core.command.ClassAccessor">
            <parameter name="ServiceClass">com.ail.core.configure.server.SetConfigurationService</parameter>
        </service>
        <service name="GetCommandScriptService" builder="ClassBuilder" key="com.ail.core.command.ClassAccessor">
            <parameter name="ServiceClass">com.ail.core.configure.server.GetCommandScriptService</parameter>
        </service>
        <service name="SetCommandScriptService" builder="ClassBuilder" key="com.ail.core.command.ClassAccessor">
            <parameter name="ServiceClass">com.ail.core.configure.server.SetCommandScriptService</parameter>
        </service>

        <!--=======================================================================-->
        <!-- Bind the default core services (above) to Commands used by Core.class -->
        <!--=======================================================================-->
        <command name="GetNamespaces" builder="ClassBuilder" key="com.ail.core.configure.server.GetNamespacesCommand">
            <parameter name="Service">GetNamespacesService</parameter>
        </command>
        <command name="GetConfiguration" builder="ClassBuilder" key="com.ail.core.configure.server.GetConfigurationCommand">
            <parameter name="Service">GetConfigurationService</parameter>
        </command>
        <command name="SetConfiguration" builder="ClassBuilder" key="com.ail.core.configure.server.SetConfigurationCommand">
            <parameter name="Service">SetConfigurationService</parameter>
        </command>
        <command name="GetCommandScript" builder="ClassBuilder" key="com.ail.core.configure.server.GetCommandScriptCommand">
            <parameter name="Service">GetCommandScriptService</parameter>
        </command>
        <command name="SetCommandScript" builder="ClassBuilder" key="com.ail.core.configure.server.SetCommandScriptCommand">
            <parameter name="Service">SetCommandScriptService</parameter>
        </command>
    </types>
</configuration>
