<?xml version="1.0" encoding="UTF-8"?>
<!--
 This file defines a test product for use in the core system. This product configuration is
 required in live deployments and is only used for testing purposes.
 $Revision$
 $Author$
 $State$
 $Date$
 $Source$
-->
<configuration xmlns:xsi="http://www.w3.org/2001/XMLSchema-instance" 
    xsi:noNamespaceSchemaLocation="http://www.appliedindustriallogic.com/schemas/Configuration.xsd">
    <name>Configuration for Test Product 2</name>
    <timeout>60000</timeout>
    <who>factory</who>
    <version>$Revision$</version>
    <manager>com.ail.core.product.resetproduct.ResetProductService</manager>
    <parentNamespace>com.ail.core.product.TestProduct1.Registry</parentNamespace>
    
    <parameter name="TestPropertyA">Product 2's A Value</parameter>
    <parameter name="TestPropertyC">C's Value</parameter>
    
    <types>
        <type name="TestProduct2" key="com.ail.core.Type" builder="CastorXMLBuilder">
            <parameter name="Script"><![CDATA[
               <type xsi:type='java:com.ail.core.Type' xmlns:xsi='http://www.w3.org/2001/XMLSchema-instance'>
                  <attribute id="name" type="string" value="TestProduct2"/>
                  <attribute id="productname" type="string" value="TestProduct2"/>
                  <attribute id="age" type="number" value="34"/>
                  <attribute id="colour" type="string" value="purple"/>
               </type>
            ]]></parameter>
        </type>
        
        <type name="TestTypeB" key="com.ail.core.Type" builder="BeanShellBuilder">
            <parameter name="Extends">TestTypeA</parameter>
            <parameter name="Script"><![CDATA[
                type=new com.ail.core.Type();
                
                a=new com.ail.core.Attribute();
                a.setId("name");
                a.setValue("TestTypeB");
                type.addAttribute(a);
                
                a=new com.ail.core.Attribute();
                a.setId("colour");
                a.setValue("TestTypeB");
                type.addAttribute(a);
            ]]></parameter>
        </type>
    </types>
    
</configuration>
