<?xml version="1.0" encoding="UTF-8"?>
<!--
 This file defines the default (factory) configuration for the
 AddQuoteNumber Service. This configuration is used by the entry point's
 resetConfiguration() method.
 This configuration doesn't represent a real live configuration. This
 is only the core service and as such it doesn't define any product
 rules. For these you have to look at the specialisations that use this
 service.
 $Revision: 1.4 $
 $State: Exp $
 $Date: 2006/10/04 22:03:15 $
 $Source: /home/bob/CVSRepository/projects/insurance/insurance.ear/insurance.jar/com/ail/insurance/quotation/addquotenumber/AddQuoteNumberDefaultConfig.xml,v $
-->
<configuration xsi:noNamespaceSchemaLocation="http://www.appliedindustriallogic.com/schemas/Configuration.xsd" xmlns:xsi="http://www.w3.org/2001/XMLSchema-instance">
    <name>CalculateTax service default configuration</name>
    <timeout>60000</timeout>
    <who>factory</who>
    <version>$Revision: 1.4 $</version>
    
    <!-- Select the method used to generate new numbers. Options are:                            -->
    <!--  ConfigurePropertyUniqueNumberHandler - which stores the numbers in configuation.       -->
    <!--  PolicyIdUniqueNumberGeneratorHandler - use the policy's unique ID as the quote number. -->
    <parameter name="UniqueQuotationNumberHandler">ConfigurePropertyUniqueNumberHandler</parameter>
    
    <!-- Next (unique) Number to use in quote number generation. The service -->
    <!-- updates this parameter as numbers are used up.                      -->
    <parameter name="NextNumber">1000</parameter>
    
    <!-- To avoid hitting the database every time a quote number is asked for, -->
    <!-- the service takes a chunk of numbers at a time, keeps track of the    -->
    <!-- ones it uses, then comes back for more when it runs out. BlockSize    -->
    <!-- controls the number that are allocated on each call.                  -->
    <parameter name="BlockSize">100</parameter>
</configuration>
