<?xml version="1.0" encoding="UTF-8"?>
<configuration xmlns:xsi="http://www.w3.org/2001/XMLSchema-instance" 
               xsi:noNamespaceSchemaLocation="http://www.appliedindustriallogic.com/schemas/Configuration.xsd">
    <timeout>-1</timeout>
    <name>Equine Plus product configuration</name>
    <parentNamespace>AIL.Base.Registry</parentNamespace>
    <who>Applied Industrial Logic</who>
    <version>1.0</version>
    <manager>com.ail.core.product.resetproduct.ResetProductService</manager>

    <types>
        
        <service name="AssessPolicyRiskRule" builder="CachingClassBuilder" key="com.ail.core.command.DroolsDecisionTableAccessor" >
            <parameter name="Url">~/PolicyRating.xls</parameter>
        </service>

        <service name="CalculatePolicyCommissionRule" builder="ClassBuilder" key="com.ail.core.command.BeanShellAccessor">
            <parameter name="Url">~/CalculateCommission.bs</parameter>
        </service>

        <service name="CalculatePolicyMgmtChgRule" builder="ClassBuilder" key="com.ail.core.command.BeanShellAccessor">
            <parameter name="Url">~/CalculateManagementCharge.bs</parameter>
        </service>
        
        <service name="StyleDocumentService" builder="ClassBuilder" key="com.ail.core.command.XSLTAccessor">
            <parameter name="Url">http://localhost:8080/portal-core/themes/industrial/style.xslt</parameter>
        </service>

        <command name="AssessSectionRisk/EquinePlusSection" builder="CachingClassBuilder" key="com.ail.insurance.quotation.assessrisk.AssessSectionRiskCommand">
            <parameter name="Service">NullService</parameter>
        </command>
        
        <type name="Quotation" builder="BeanShellBuilder">
            <parameter name="extends">BaseQuotation</parameter>
            <parameter name="Url">~/Quotation.bs</parameter>
        </type>
        
        <!-- Equine section  -->
        <type name="EquinePlusSection" builder="CastorXMLBuilder" key="com.ail.insurance.policy.Section">
            <parameter name="Url">~/EquinePlusSection.xml</parameter>
        </type>
        
        <type name="SaddleryAndTackExcess" builder="CastorXMLBuilder" key="com.ail.insurance.policy.Excess">
            <parameter name="Url">~/SaddleryAndTackExcess.xml</parameter>
        </type>
        
        <type name="HorseAsset" builder="CastorXMLBuilder" key="com.ail.insurance.policy.Asset">
            <parameter name="Url">~/HorseAsset.xml</parameter>
        </type>
        
        <type name="CoverageAsset" builder="CastorXMLBuilder" key="com.ail.insurance.policy.Asset">
            <parameter name="Url">~/CoverageAsset.xml</parameter>
        </type>
        
        <type name="HorseAge" builder="CastorXMLBuilder" singleInstance="true" key="com.ail.openquote.ui.util.Choice"> 
            <parameter name="Url">~/HorseAge.xml</parameter>
        </type>
        
        <type name="HorseColour" builder="CastorXMLBuilder" singleInstance="true" key="com.ail.openquote.ui.util.Choice">
            <parameter name="Url">~/HorseColour.xml</parameter>
        </type>
        
        <type name="HorseHeightHands" builder="CastorXMLBuilder" singleInstance="true" key="com.ail.openquote.ui.util.Choice">
            <parameter name="Url">~/HorseHeightHands.xml</parameter>
        </type>
        
        <type name="QuotationPageFlow" builder="CastorXMLBuilder" singleInstance="true" key="com.ail.openquote.ui.PageFlow">
            <parameter name="Url">~/QuotationPageFlow.xml</parameter>
        </type>

        <type name="QuotationDocument" builder="CastorXMLBuilder" singleInstance="true" key="com.ail.core.document.model.DocumentDefinition">
            <parameter name="Url">~/QuotationDocument.xml</parameter>
        </type>
        
    </types>
</configuration>
