<?xml version="1.0" encoding="UTF-8"?>
<!--
 This file defines a test product which will always has two referrals.
 $Revision$
 $Author$
 $State$
 $Date$
 $Source$
-->
<configuration xmlns:xsi="http://www.w3.org/2001/XMLSchema-instance" 
               xsi:noNamespaceSchemaLocation="http://www.appliedindustriallogic.com/schemas/Configuration.xsd">
    <name>Configuration for Test Product 7</name>
    <timeout>60000</timeout>
    <who>factory</who>
    <version>$Revision$</version>
    <manager>com.ail.core.product.resetproduct.ResetProductService</manager>
    <parentNamespace>com.ail.core.product.TestProduct1.Registry</parentNamespace>
    
    <types>
        <service name="PolicyRule" builder="ClassBuilder" key="com.ail.core.command.BeanShellAccessor" >
            <parameter name="Script"><![CDATA[
                import com.ail.financial.CurrencyAmount;
                import com.ail.financial.Currency;
                import com.ail.insurance.policy.*;
                
                /* get hold of the as */
                as=args.getAssessmentSheetArgRet();
                
                /* add two lines - just to show that this rule has been run */
                as.addFixedSum("dummyid1", "Loading", null, "total premium", new CurrencyAmount(0.0, Currency.GBP));
                as.addReferral("dummyid3", "No reason", null);
                as.addReferral("dummyid4", "No reason", null);
            ]]></parameter>
        </service>

        <type name="TestProduct8" key="com.ail.core.Type" builder="BeanShellBuilder">
            <parameter name="Extends">TestProduct1</parameter>
            <parameter name="Script"><![CDATA[
                type=new com.ail.insurance.policy.Policy();
                type.setProductTypeId("com.ail.core.product.TestProduct8");
            ]]></parameter>
        </type>
    </types>
</configuration>
