<?xml version="1.0" encoding="UTF-8"?>
<configuration xsi:noNamespaceSchemaLocation="http://www.appliedindustriallogic.com/schemas/Configuration.xsd"
    xmlns:xsi="http://www.w3.org/2001/XMLSchema-instance">
    <name>Acceptance EJB configuration</name>
    <timeout>5000</timeout>
    <who>factory</who>
    <version>$Revision: 1.4 $</version>
    <types>
        <command name="ProduceDocumentation" builder="ClassBuilder" key="com.ail.insurance.acceptance.ProduceDocumentationCommandImpl">
            <parameter name="Service">com.ail.insurance.acceptance.ProduceDocumentationService</parameter>
        </command>
        <command name="PutOnRisk" builder="ClassBuilder" key="com.ail.insurance.acceptance.PutOnRiskCommandImpl">
            <parameter name="Service">com.ail.insurance.acceptance.PutOnRiskService</parameter>
        </command>
        <command name="CollectPremium" builder="ClassBuilder" key="com.ail.insurance.acceptance.CollectPremiumCommandImpl">
            <parameter name="Service">com.ail.insurance.acceptance.CollectPremiumService</parameter>
        </command>
        <command name="AcceptQuotation" builder="ClassBuilder" key="com.ail.insurance.acceptance.acceptquotation.AcceptQuotationCommandImpl">
            <parameter name="Service">com.ail.insurance.acceptance.acceptquotation.AcceptQuotationService</parameter>
        </command>
    </types>
</configuration>
