<?xml version="1.0" encoding="UTF-8"?>
<!--
 This file defines the default (factory) configuration use by ListProducts service.
 The configuration defines the products that are know to the system.
 $Revision: 1.2 $
 $State: Exp $
 $Date: 2006/07/15 15:01:44 $
 $Source: /home/bob/CVSRepository/projects/core/core.ear/core.jar/com/ail/core/product/ProductCatalogDefaultConfig.xml,v $
-->
<configuration xmlns:xsi="http://www.w3.org/2001/XMLSchema-instance" 
               xsi:noNamespaceSchemaLocation="http://www.appliedindustriallogic.com/schemas/Configuration.xsd">
    <name>ProductCatalog configuration</name>
    <timeout>60000</timeout>
    <who>factory</who>
    <version>$Revision: 1.2 $</version>
    <manager>com.ail.core.product.listproducts.ListProductsService</manager>
    
    <group name="products">
        <parameter name="com.ail.core.product.TestProduct1"/>
        <parameter name="com.ail.core.product.TestProduct2"/>
        <parameter name="com.ail.core.product.TestProduct3"/>
    </group>
</configuration>
