<?xml version="1.0" encoding="UTF-8"?>
<!--
 This file defines the default (factory) configuration for the Subrogation
 component. This configuration is used by the component's resetConfiguration()
 method.
 $Revision: 1.3 $
 $State: Exp $
 $Date: 2006/10/04 22:03:13 $
 $Source: /home/bob/CVSRepository/projects/insurance/insurance.ear/subrogation-ejb.jar/com/ail/insurance/subrogation/SubrogationDefaultConfig.xml,v $
-->
<configuration xsi:noNamespaceSchemaLocation="http://www.appliedindustriallogic.com/schemas/Configuration.xsd" xmlns:xsi="http://www.w3.org/2001/XMLSchema-instance">
  <name>Subrogation component default configuration</name>
  <timeout>1000</timeout>
  <who>factory</who>
  <version>$Revision: 1.3 $</version>
  
  <types>
    <!--====================================-->
    <!--   Define the component's services  -->
    <!--====================================-->
    <service name="MakeARecoveryService" builder="ClassBuilder" key="com.ail.core.command.ClassAccessor">
      <parameter name="ServiceClass">com.ail.insurance.subrogation.makearecovery.MakeARecoveryService</parameter>
    </service>
    
    <!--=======================================================================-->
    <!-- Bind the default core services (above) to Commands used by Core.class -->
    <!--=======================================================================-->
    <command name="MakeARecovery" builder="ClassBuilder" key="com.ail.insurance.subrogation.makearecovery.MakeARecoveryCommand">
      <parameter name="Service">MakeARecoveryService</parameter>
    </command>
  </types>
</configuration>
