<?xml version="1.0" encoding="UTF-8"?>
<!-- This file defines the default (factory) configuration for the Core. This configuration is used by the core's resetConfiguration() 
    method. -->
<configuration xsi:noNamespaceSchemaLocation="http://www.appliedindustriallogic.com/schemas/Configuration.xsd"
    xmlns:xsi="http://www.w3.org/2001/XMLSchema-instance">

    <name>Default Core Configuration</name>
    <timeout>-1</timeout>
    <who>factory</who>
    <version>1.4</version>

    <!-- Next (unique) Number to use in unique number generation for the various -->
    <!-- types of number. The GenerateUniqueNumber service updates this parameter -->
    <!-- as numbers are used. These values can be overridden by product. -->
    <parameter name="InvoiceNumberNextNumber">1000</parameter>
    <parameter name="PolicyNumberNextNumber">1000</parameter>
    <parameter name="QuoteNumberNextNumber">1000</parameter>

    <!-- To avoid hitting the database every time a unique number is asked for, -->
    <!-- the GenerateUniqueNumber service takes a chunk of numbers at a time, -->
    <!-- keeps track of the ones it uses, then comes back for more when it runs -->
    <!-- out. *BlockSize controls the number that are allocated on each call. -->
    <!-- These values can be overridden by product. -->
    <parameter name="InvoiceNumberBlockSize">100</parameter>
    <parameter name="PolicyNumberBlockSize">100</parameter>
    <parameter name="QuoteNumberBlockSize">100</parameter>
    
    <group name="ProductURLHandler">
        <parameter name="Protocol">http</parameter>
        <parameter name="Host">localhost</parameter>
        <parameter name="Port">8080</parameter>
        <parameter name="Realm">PortalRealm</parameter>
        <parameter name="Path">/api/secure/webdav/guest/document_library/Product</parameter>
        <parameter name="Username">productreader@openquote.local</parameter>
        <parameter name="Password">productreader</parameter>
    </group>
    
    <group name="JEEAccessorContext">
        <!--
        In most deployments these settings are picked up from the server's environment, but in some
        circumstances it can be useful to override them - particularly if your client is accessing 
        remote EJBs.
        
        <parameter name="java.naming.factory.url.pkgs">org.jboss.ejb.client.naming</parameter>
        <parameter name="java.naming.factory.initial">org.jboss.naming.remote.client.InitialContextFactory</parameter>
        <parameter name="java.naming.provider.url">remote://localhost:4447</parameter>
        <parameter name="jboss.naming.client.ejb.context">true</parameter>
        <parameter name="java.naming.security.principal">openquote</parameter>
        <parameter name="java.naming.security.credentials">password</parameter>
        -->
    </group>

    <types>
        <service name='AcceptanceServicesEJB' builder='ClassBuilder' key='com.ail.core.command.EJBAccessor'>
            <parameter name='JndiName'>ejb:/acceptance-ejb//AcceptanceBean!com.ail.insurance.acceptance.AcceptanceLocal</parameter>
        </service>

        <service name="GenerateQuotationDocumentService" key="com.ail.core.command.EJBAccessor">
            <parameter name="JndiName">ejb:/quotation-ejb//QuotationBean!com.ail.insurance.quotation.QuotationLocal</parameter>
        </service>

        <service name="OnRiskEJB" key="com.ail.core.command.EJBAccessor">
            <parameter name="JndiName">ejb:/onrisk-ejb//OnRiskBean!com.ail.insurance.onrisk.OnRiskLocal</parameter>
        </service>

        <service name='PersistenceService' builder='ClassBuilder' key='com.ail.core.command.EJBAccessor'>
            <parameter name='JndiName'>ejb:/persistence-server-ejb//PersistenceServerBean!com.ail.core.persistence.PersistenceServerLocal</parameter>
        </service>

        <service name="JMSQueueService" key="com.ail.core.command.JMSAccessor">
            <parameter name="Factory">ConnectionFactory</parameter>
            <parameter name="Queue">queue/OpenQuoteCommandQueue</parameter>
        </service>

        <!-- Map all of the logger commands to the stdio logger -->
        <command name="InfoLogger" builder="ClassBuilder" key="com.ail.core.logging.LoggingCommandImpl">
            <parameter name="Service">com.ail.core.logging.JavaLoggerService</parameter>
        </command>
        <command name="DebugLogger" builder="ClassBuilder" key="com.ail.core.logging.LoggingCommandImpl">
            <parameter name="Service">com.ail.core.logging.JavaLoggerService</parameter>
        </command>
        <command name="WarningLogger" builder="ClassBuilder" key="com.ail.core.logging.LoggingCommandImpl">
            <parameter name="Service">com.ail.core.logging.JavaLoggerService</parameter>
        </command>
        <command name="ErrorLogger" builder="ClassBuilder" key="com.ail.core.logging.LoggingCommandImpl">
            <parameter name="Service">com.ail.core.logging.JavaLoggerService</parameter>
        </command>
        <command name="FatalLogger" builder="ClassBuilder" key="com.ail.core.logging.LoggingCommandImpl">
            <parameter name="Service">com.ail.core.logging.JavaLoggerService</parameter>
        </command>

        <!-- Map all of the persistence commands to the persistence server -->
        <command name="OpenPersistenceSession" builder="ClassBuilder" key="com.ail.core.persistence.OpenSessionCommandImpl">
            <parameter name="Service">PersistenceService</parameter>
        </command>
        <command name="ClosePersistenceSession" builder="ClassBuilder" key="com.ail.core.persistence.CloseSessionCommandImpl">
            <parameter name="Service">PersistenceService</parameter>
        </command>
        <command name="Update" builder="ClassBuilder" key="com.ail.core.persistence.UpdateCommandImpl">
            <parameter name="Service">PersistenceService</parameter>
        </command>
        <command name="Query" builder="ClassBuilder" key="com.ail.core.persistence.QueryCommandImpl">
            <parameter name="Service">PersistenceService</parameter>
        </command>
        <command name="Load" builder="ClassBuilder" key="com.ail.core.persistence.LoadCommandImpl">
            <parameter name="Service">PersistenceService</parameter>
        </command>
        <command name="Create" builder="ClassBuilder" key="com.ail.core.persistence.CreateCommandImpl">
            <parameter name="Service">PersistenceService</parameter>
        </command>
        <command name="Delete" builder="ClassBuilder" key="com.ail.core.persistence.DeleteCommandImpl">
            <parameter name="Service">PersistenceService</parameter>
        </command>

        <command name='FetchQuoteDocument' builder='ClassBuilder' key='com.ail.insurance.quotation.FetchDocumentCommandImpl'>
            <parameter name='Service'>com.ail.insurance.quotation.fetchdocument.FetchDocumentService</parameter>
        </command>
        
        <command name='GenerateQuotationDocument' builder='ClassBuilder' key='com.ail.insurance.quotation.GenerateDocumentCommandImpl'>
            <parameter name='Service'>GenerateQuotationDocumentService</parameter>
        </command>
        <command name='GenerateWordingDocument' builder='ClassBuilder' key='com.ail.insurance.onrisk.GenerateWordingCommandImpl'>
            <parameter name='Service'>OnRiskEJB</parameter>
        </command>
        <command name='GenerateCertificateDocument' builder='ClassBuilder' key='com.ail.insurance.onrisk.GenerateCertificateCommandImpl'>
            <parameter name='Service'>OnRiskEJB</parameter>
        </command>
        <command name='GenerateInvoiceDocument' builder='ClassBuilder' key='com.ail.insurance.onrisk.GenerateInvoiceCommandImpl'>
            <parameter name='Service'>OnRiskEJB</parameter>
        </command>

        <command name="AcceptQuotation" builder="ClassBuilder" key="com.ail.insurance.acceptance.AcceptQuotationCommandImpl">
            <parameter name="Service">AcceptanceServicesEJB</parameter>
        </command>

        <command name="QueuedClearProductCacheCommand" builder="ClassBuilder" key="com.ail.core.product.ClearProductCacheCommandImpl">
            <parameter name="Service">JMSQueueService</parameter>
        </command>
        <command name="QueuedResetProductCommand" builder="ClassBuilder" key="com.ail.core.product.ResetProductCommandImpl">
            <parameter name="Service">JMSQueueService</parameter>
        </command>
    </types>
</configuration>
